{"authoredVersion":"0.6.0","digest":"0c00eb8b111c5b9a41ee25580876ef2f2e09cccb52aa7ee20f75f34211f1fbb2","files":{".claude-plugin/marketplace.json":{"mode":"100644","sha256":"ace6449b3c566b5e2d4295034464fc1b703c859e388608b19463d61ad5b0da81"},"LICENSE":{"mode":"100644","sha256":"d667d2b6612d82b5ba20d5cb650aae6fd33bf86be8b3c467186fe43775238be6"},"beadhive/.claude-plugin/plugin.json":{"mode":"100644","sha256":"5e0743f353ec2d6fa3933c8a39b56e5479442ff9856f204fbd4f010c4fcd5787"},"beadhive/.mcp.json":{"mode":"100644","sha256":"5ad0065794cd6d941faee18e9eba206b0ca86295650c4206bc6755971f63bf80"},"beadhive/LICENSE":{"mode":"100644","sha256":"d667d2b6612d82b5ba20d5cb650aae6fd33bf86be8b3c467186fe43775238be6"},"beadhive/README.md":{"mode":"100644","sha256":"26305c1290a20b99f250ae17c2ecc4e3226070d2d9517e73aefe70dc0bc89838"},"beadhive/agents/analyst.md":{"mode":"100644","sha256":"cca7cc6641d0fc29fe2a2d02fa1fcd22db050b6a9489843dd042b2a71e3ce6a3"},"beadhive/agents/controller.md":{"mode":"100644","sha256":"45eda548f8fb3de7af7900f7735c8fd7687486ed0ed897b510e02081cafd92b2"},"beadhive/agents/custodian.md":{"mode":"100644","sha256":"c5a313c53d26bb971084a1617b146b8c1d6015ffc7b0ffbc15438b620e2168f7"},"beadhive/agents/developer.md":{"mode":"100644","sha256":"a2af80919a79e2327ed593891269ca7ee9d47c045fe38524e730d4548b233407"},"beadhive/agents/director.md":{"mode":"100644","sha256":"c4f260ddbbd6a18f2af997da9fa68c12da6f1bb4891cf77a6eef598798437035"},"beadhive/agents/dispatcher.md":{"mode":"100644","sha256":"3efc54b8bf83684603ebe7bd3bfb5e9b11e727b2d4699ce0f451ca156e5fef58"},"beadhive/agents/merger.md":{"mode":"100644","sha256":"607186a1b924bbb812eb04fc63b2d34eeefe5a8f07f830bf31003caf3ef58b3a"},"beadhive/agents/planner.md":{"mode":"100644","sha256":"9c17c697c6a7423b2139c354e626debfdbd615d91b3c0485ea412eb889d2d3ea"},"beadhive/agents/reviewer.md":{"mode":"100644","sha256":"d2d5949e99a706d82c6e4bbab16cc2a37c11b84cbb546b3a003871c3c7ae7f3e"},"beadhive/agents/supervisor.md":{"mode":"100644","sha256":"596c19b27266dc334269a00b5c0f5c882058176c97a97225284378fedf97cba4"},"beadhive/agents/warden.md":{"mode":"100644","sha256":"c8f0bdd31dee241dee47e63ce31e93250713fb0622a51b7e90c0754d34373122"},"beadhive/hooks/hooks.json":{"mode":"100644","sha256":"b8220241e2f885d905833bfa5effb276263a953054d9ccff7171db77e4ed7d5c"},"beadhive/instructions/AGENTS.md":{"mode":"100644","sha256":"498425e43e9edd1119b81ca7494d604ed0a6d9bf8c7b7467c725db39014293d5"},"beadhive/instructions/OPERATOR-COMMUNICATION.md":{"mode":"100644","sha256":"2a5d2a6014cccf90cff4d243b800ba9340957019d39044499bdb9e894279f0db"},"beadhive/instructions/README.md":{"mode":"100644","sha256":"05aeb059c586788baea3f9a7a0a4561c5c52d894a17f7e5e2382e2236b90e3bf"},"beadhive/output-styles/beadhive-operator-brief-verbose.md":{"mode":"100644","sha256":"5cdcca6637011cebe02444e4d029d9e133e4df3c849985caff42c0a8c4739c3d"},"beadhive/output-styles/beadhive-operator-brief.md":{"mode":"100644","sha256":"a029e9ca8fc2ed74dda310f0f2b05ae8cf88a90cc65c8f48f24cdee0d74c71dc"},"beadhive/output-styles/planning-seat.md":{"mode":"100644","sha256":"b8aa071b726846e3df70232ef294639014d23df2354e2b95bc41035d5721d369"},"beadhive/scripts/approve-readonly.sh":{"mode":"100755","sha256":"3598610209b5e1a695082d1a146d252fb3ad27321feecaa09bd37b4ed0668d9d"},"beadhive/scripts/bd-steer.sh":{"mode":"100755","sha256":"af465c6556661ca506821d5bcf0a51c4c3b5810d26cf2ef898ed2566ce586739"},"beadhive/scripts/bh-compatibility.sh":{"mode":"100644","sha256":"d0b9b755f81325dcc20783598a7a0dfa6fd783c6ff7417d29ae448a7761777a7"},"beadhive/scripts/bh-preflight.sh":{"mode":"100755","sha256":"15605a49c59c79ff55213e52bce8c864c5856068c63d14b32710e49d29dfff11"},"beadhive/scripts/hive-context.sh":{"mode":"100755","sha256":"a9a39387e812153fe924d2567746befa6b4c55de2a10c6f6ae84d4c8bcba2fae"},"beadhive/skills/backfill/COMPANIONS.md":{"mode":"100644","sha256":"3db8827442efe45d7e8080d749b64ef1808c2d368ab0671984ec66a0d7beb0c1"},"beadhive/skills/backfill/GUIDE.md":{"mode":"100644","sha256":"572e92b165524ecc38b0a8a8dd2cd7ab8dd64caa968adbc9e4fe7a42be476c09"},"beadhive/skills/backfill/LICENSE":{"mode":"100644","sha256":"d667d2b6612d82b5ba20d5cb650aae6fd33bf86be8b3c467186fe43775238be6"},"beadhive/skills/backfill/SKILL.md":{"mode":"100644","sha256":"0b3a10fe0df326aec43f5449cf668240397ef45f77b16cfa154107574d174e91"},"beadhive/skills/backfill/references/bridges.md":{"mode":"100644","sha256":"f68baa3fd078435b998eb436cea382c2ba37964060ade4bc655b6a9b15998729"},"beadhive/skills/backfill/scripts/reconcile.sh":{"mode":"100755","sha256":"2c58154d4f44650a2c7be259e6b8d4c026b630dc493084f3c10b2d929ea1fe27"},"beadhive/skills/backfill/steps/010-collect-and-bridge.md":{"mode":"100644","sha256":"d11cc9b9b021d699c42575ee5be52b0c063cdb53461086841999c6512e9e9ceb"},"beadhive/skills/backfill/steps/020-classify.md":{"mode":"100644","sha256":"1b9c82cf278bf23710a3e03fe004a82dfef5bf2640a0199cec6da2e21a6c2aea"},"beadhive/skills/backfill/steps/030-emit-proposal.md":{"mode":"100644","sha256":"60c9896ff39a320f36b09c11590dc45eaf06ee3d32511c0036b69b1404870e71"},"beadhive/skills/backfill/steps/040-apply.md":{"mode":"100644","sha256":"751d84bf7388cde1eeb6f01977383ca346763d455372c885e5186fa802534883"},"beadhive/skills/backfill/steps/050-verify-idempotency.md":{"mode":"100644","sha256":"b8bd38cda0d5bbebfbacb036be8b908be9b9addc9ea59a93e3cb1e14a129416e"},"beadhive/skills/control/COMPANIONS.md":{"mode":"100644","sha256":"fc5a2287976363333d5ede2fa2c8a4a2d5c4d5d1f96fdef315bc44681fcb7302"},"beadhive/skills/control/LICENSE":{"mode":"100644","sha256":"d667d2b6612d82b5ba20d5cb650aae6fd33bf86be8b3c467186fe43775238be6"},"beadhive/skills/control/SKILL.md":{"mode":"100644","sha256":"d25b73efe1d7e860c574d4fa98fa77d0b5f9061dae669c9c0dee7851fad2f8c7"},"beadhive/skills/developer/COMPANIONS.md":{"mode":"100644","sha256":"029ea645c8c0fff52acbc94a6a9a0aba507a2862d848df50ea0b88a98785e7a9"},"beadhive/skills/developer/LICENSE":{"mode":"100644","sha256":"d667d2b6612d82b5ba20d5cb650aae6fd33bf86be8b3c467186fe43775238be6"},"beadhive/skills/developer/SKILL.md":{"mode":"100644","sha256":"5d2002a7d4d4a672ef74d615132d1f7397e92e0b8a3fc08742c9a4b94fa93c78"},"beadhive/skills/dispatcher/COMPANIONS.md":{"mode":"100644","sha256":"a4f78987508bf9452bcfdabe709bbafe6393340268972de18a1eeb518d8905e1"},"beadhive/skills/dispatcher/LICENSE":{"mode":"100644","sha256":"d667d2b6612d82b5ba20d5cb650aae6fd33bf86be8b3c467186fe43775238be6"},"beadhive/skills/dispatcher/SKILL.md":{"mode":"100644","sha256":"aac511eb5bbaa8860f9a934c263382be206547979ae12f6cd203de3022b38c4c"},"beadhive/skills/dispatcher/references/collapsed-mode.md":{"mode":"100644","sha256":"f52f73681d4011030f310fe58b80d79af5427883cdcd7a1e75a9f8a04d8519e2"},"beadhive/skills/dispatcher/references/scheduling.md":{"mode":"100644","sha256":"5c7483f50fbdacf627d3c9d925f58a169ae6890b6321e33f45f139fca7bf3d6d"},"beadhive/skills/dispatcher/references/workstream-tier.md":{"mode":"100644","sha256":"c56ced406ff08e1596f68255c91da4a3ae32c33afc34ad4c9718516d2eea7f12"},"beadhive/skills/groom/COMPANIONS.md":{"mode":"100644","sha256":"68548aa544105e0595ca08acfeb3e0268fe121f54dd5cf2f6ce608890afd6847"},"beadhive/skills/groom/LICENSE":{"mode":"100644","sha256":"d667d2b6612d82b5ba20d5cb650aae6fd33bf86be8b3c467186fe43775238be6"},"beadhive/skills/groom/SKILL.md":{"mode":"100644","sha256":"633a992e78af980f20570130dd0f8cb0685f8286b42129aa46692979e215e93f"},"beadhive/skills/merger/COMPANIONS.md":{"mode":"100644","sha256":"364e1578f3b3101adbf839a6226d56679cbd6451521dc9df7423b6862d3fe620"},"beadhive/skills/merger/LICENSE":{"mode":"100644","sha256":"d667d2b6612d82b5ba20d5cb650aae6fd33bf86be8b3c467186fe43775238be6"},"beadhive/skills/merger/SKILL.md":{"mode":"100644","sha256":"bf0d96d8dbe7f98aaa94ecfdd24c58a5ed1d26d9c5b3d7f16d9bfc027a96938b"},"beadhive/skills/modularize/COMPANIONS.md":{"mode":"100644","sha256":"da486e05870f834fc15624c4dd4e2d85d7055753341bee5420540fdd8e839b6d"},"beadhive/skills/modularize/LICENSE":{"mode":"100644","sha256":"d667d2b6612d82b5ba20d5cb650aae6fd33bf86be8b3c467186fe43775238be6"},"beadhive/skills/modularize/SKILL.md":{"mode":"100644","sha256":"3d86717198b6ff02898184b7ef29f612729f9f62737bc278046cff753d9476b9"},"beadhive/skills/modularize/agents/openai.yaml":{"mode":"100644","sha256":"d59718b6fb6b0fda44784211457a3c2e6bf43be120dce15b84bba1263e5b4bd8"},"beadhive/skills/operator-communication/COMPANIONS.md":{"mode":"100644","sha256":"8d69ceb649ee29348f639e8229cfa9c51a982b4b81455e5db4d3d3021bec55b1"},"beadhive/skills/operator-communication/LICENSE":{"mode":"100644","sha256":"d667d2b6612d82b5ba20d5cb650aae6fd33bf86be8b3c467186fe43775238be6"},"beadhive/skills/operator-communication/SKILL.md":{"mode":"100644","sha256":"c8308207973baa5a0aa0ef7ab56f6aeb324a60a351a9b45f9150374b7df9f9aa"},"beadhive/skills/operator-communication/references/OPERATOR-COMMUNICATION.md":{"mode":"100644","sha256":"2a5d2a6014cccf90cff4d243b800ba9340957019d39044499bdb9e894279f0db"},"beadhive/skills/overview/COMPANIONS.md":{"mode":"100644","sha256":"cb5161f3c3ba845b74d3199736451eafc24eb8ba35275c701e7efee186d9cee2"},"beadhive/skills/overview/LICENSE":{"mode":"100644","sha256":"d667d2b6612d82b5ba20d5cb650aae6fd33bf86be8b3c467186fe43775238be6"},"beadhive/skills/overview/SKILL.md":{"mode":"100644","sha256":"2019bf290dc5566be6e3f2d066954ff714c89cd8afeeb476afdd87afee22f718"},"beadhive/skills/overview/references/bead-lifecycle.md":{"mode":"100644","sha256":"f27a8e1d84fbbfe140064ec777c9be364ee621ae015f9663537508df6fdb2ea6"},"beadhive/skills/overview/references/beadflow-and-planes.md":{"mode":"100644","sha256":"68f9017ad3caba66cbb56574ea0d57cf0bd9d251920583d63cab713a29974ab6"},"beadhive/skills/overview/references/dispatch-and-scheduling.md":{"mode":"100644","sha256":"87315705127c8ef158cb50cf3f03d0a418c0af5b2fd9a52fd06e623592a57c91"},"beadhive/skills/overview/references/glossary.md":{"mode":"100644","sha256":"a588e469758fcdc2c5aff680266b2c3ee4157040772a94f975fba1ffffa03238"},"beadhive/skills/overview/references/roles-and-seats.md":{"mode":"100644","sha256":"e547f95c8204